{
  "envelopeVersion": 1,
  "contract": "wow-ledgerlink",
  "contractVersion": 1,
  "capturedAt": "2026-10-28T12:00:05Z",
  "appVersion": "0.1.0",
  "collectorVersion": "0.1.0",
  "payload": {
    "exportString": "!RL1!char!eJxtUktrGzEQ/itmzoqR/NjN6rZNGhJoTSFNL8YHdTXyCo+lotU6Nfb+9zJrOxCodBHSp+/FnKBrWtwb0EqAsTaGX5g6HwNokFM1lSCgIY8hgz6BDxmTMw2CVmopSwG/e08WNKipWk5LEECxMYSgAcPbKwhIuB3Z1CAA//6JKaOtM2hVVvKyBLy3kdm3vWeqH2SOmO4W82p5J+svD49fn9iF64lWZs/UdTCTp5jwgIkVzPv4G/Nb8Pm/kP7jYf35JfREm0FA6gk7zKAhxLQ3NKY2Xcd26m/148tqFOLg8NzvTeCkeEACXUgBzjT50llN5E1oEATHIXu1s/LbNk9eW+8yDAI6vOGb1rBBa7K5hDAJ9PoEHUUuqRBAPuxAw7lxzsznS8Tzs8+416qSqtLy0y5uh5kuikWhy/tKntv1z7YPFpPr03Fzbs8s6OlAoO/lID60BDDvi2XZaqZumLIYNgKyIQy5Y49NDM5vGVcKCNFiNzrm0/hZKq6KTc8G7pZis4t9vqIufXAa56yS8nukjGHyEBNejIUuc4FMtZCVAOud801P+chXFU9Uh/k2QsvrCO08EVrQcwE5ZkPsY9gMwz8TBeP3"
  }
}
